{
  "$schema": "../schema/leverancier.schema.json",
  "$comment": "Waarden met de hand gecontroleerd op de tarievenpagina van OM | nieuwe energie (samenom.nl), tab Dynamisch. De tab laadt met JavaScript.",
  "id": "om",
  "naam": "OM | nieuwe energie",
  "website": "https://www.samenom.nl",
  "tariefUrl": "https://www.samenom.nl/tarieven/",
  "producten": {
    "stroom": true,
    "gas": true
  },
  "kenmerken": {
    "automatischAfschakelen": null
  },
  "regels": {},
  "handmatig": {
    "stroomVastPerMaand": {
      "waarde": 8.570839,
      "inclBtw": true,
      "geverifieerd": true,
      "gecontroleerdOp": "2026-09-30",
      "bron": "https://www.samenom.nl/tarieven/",
      "notitie": "Tarievenpagina van OM, tab Consument > Dynamisch: 'Vaste leveringskosten vanaf 1/1/2026 €0,281781 (per dag per aansluiting)' × 365/12. Incl. btw: hetzelfde bedrag staat op de tab Flex, waar alle tarieven incl. 21% btw zijn (€ 85,00 per jaar excl. btw)."
    },
    "stroomInkoopopslag": {
      "waarde": 0.025,
      "inclBtw": true,
      "geverifieerd": true,
      "gecontroleerdOp": "2026-09-30",
      "bron": "https://www.samenom.nl/tarieven/",
      "notitie": "Tarievenpagina van OM, tab Consument > Dynamisch: 'Inkoopvergoeding levering is €0,13585 per kWh inclusief btw en energiebelasting'; min de energiebelasting van € 0,110848 incl. btw (zelfde pagina) = € 0,025 incl. btw"
    },
    "gasVastPerMaand": {
      "waarde": 8.570839,
      "inclBtw": true,
      "geverifieerd": true,
      "gecontroleerdOp": "2026-09-30",
      "bron": "https://www.samenom.nl/tarieven/",
      "notitie": "Tarievenpagina van OM, tab Consument > Dynamisch: 'Vaste leveringskosten vanaf 1/1/2026 €0,281781 (per dag per aansluiting)' × 365/12. Incl. btw: hetzelfde bedrag staat op de tab Flex, waar alle tarieven incl. 21% btw zijn (€ 85,00 per jaar excl. btw)."
    },
    "gasInkoopopslag": {
      "waarde": 0.08,
      "inclBtw": true,
      "geverifieerd": true,
      "gecontroleerdOp": "2026-09-30",
      "bron": "https://www.samenom.nl/tarieven/",
      "notitie": "Tarievenpagina van OM, tab Consument > Dynamisch: 'Inkoopvergoeding gas is €0,80680 per m³ inclusief btw en energiebelasting'; min de energiebelasting van € 0,726799 incl. btw (zelfde pagina) = € 0,08 incl. btw"
    },
    "terugleverCorrectie": {
      "waarde": -0.025,
      "inclBtw": true,
      "geverifieerd": true,
      "gecontroleerdOp": "2026-09-30",
      "bron": "https://www.samenom.nl/tarieven/",
      "notitie": "Tarievenpagina van OM, tab Consument > Dynamisch: 'Inkoopvergoeding teruglevering is €0,02500 per kWh inclusief btw'; 'Voor alles wat je per kwartier meer teruglevert dan je afneemt, betalen wij aan jou in dat kwartier de marktprijs minus de inkoopvergoeding teruglevering'"
    }
  }
}
