{
  "$schema": "../schema/leverancier.schema.json",
  "$comment": "Waarden met de hand gecontroleerd in de rekentool van Eneco (testadres Eise Eisinga Planetarium; Madurodam gaf 'geen aanbod', want grootverbruik). Geen automatische adapter: de API vraagt een sessietoken en werkt met een winkelmandje op de server.",
  "id": "eneco",
  "naam": "Eneco",
  "website": "https://www.eneco.nl",
  "tariefUrl": "https://www.eneco.nl/duurzame-energie/dynamisch-energiecontract/dynamische-tarieven/",
  "producten": {
    "stroom": true,
    "gas": true
  },
  "kenmerken": {
    "automatischAfschakelen": null
  },
  "regels": {},
  "handmatig": {
    "stroomVastPerMaand": {
      "waarde": 7,
      "inclBtw": true,
      "geverifieerd": true,
      "gecontroleerdOp": "2026-09-26",
      "bron": "https://www.eneco.nl/duurzame-energie/bestellen2/",
      "notitie": "Prijsopbouw in de rekentool van Eneco, propositie 'Dynamisch groene stroom & gas', testadres Eise Eisinga Planetarium (8801KE 3); bedragen incl. btw (energiebelasting € 0,11085/kWh); 'Vaste leveringskosten' € 84,00 per jaar"
    },
    "stroomInkoopopslag": {
      "waarde": 0.02297,
      "inclBtw": true,
      "geverifieerd": true,
      "gecontroleerdOp": "2026-09-26",
      "bron": "https://www.eneco.nl/duurzame-energie/bestellen2/",
      "notitie": "Prijsopbouw in de rekentool van Eneco, propositie 'Dynamisch groene stroom & gas', testadres Eise Eisinga Planetarium (8801KE 3); bedragen incl. btw (energiebelasting € 0,11085/kWh); 'inkoopvergoeding € 0,02297 / kWh'"
    },
    "gasVastPerMaand": {
      "waarde": 7,
      "inclBtw": true,
      "geverifieerd": true,
      "gecontroleerdOp": "2026-09-26",
      "bron": "https://www.eneco.nl/duurzame-energie/bestellen2/",
      "notitie": "Prijsopbouw in de rekentool van Eneco, propositie 'Dynamisch groene stroom & gas', testadres Eise Eisinga Planetarium (8801KE 3); bedragen incl. btw (energiebelasting € 0,11085/kWh); gas 'Vaste leveringskosten' € 84,00 per jaar"
    },
    "gasInkoopopslag": {
      "waarde": 0.10471,
      "inclBtw": true,
      "geverifieerd": true,
      "gecontroleerdOp": "2026-09-26",
      "bron": "https://www.eneco.nl/duurzame-energie/bestellen2/",
      "notitie": "Prijsopbouw in de rekentool van Eneco, propositie 'Dynamisch groene stroom & gas', testadres Eise Eisinga Planetarium (8801KE 3); bedragen incl. btw (energiebelasting € 0,11085/kWh); 'inkoopvergoeding € 0,10471 / m³'"
    },
    "terugleverCorrectie": {
      "waarde": 0,
      "inclBtw": true,
      "geverifieerd": true,
      "gecontroleerdOp": "2026-09-26",
      "bron": "https://www.eneco.nl/duurzame-energie/dynamisch-energiecontract/",
      "notitie": "'Geen terugleverkosten bij zonnepanelen'"
    }
  }
}
