{
  "$schema": "../schema/leverancier.schema.json",
  "$comment": "Waarden met de hand gecontroleerd in de rekentool van Pure Energie. Geen automatische adapter: die rekentool houdt een sessie bij op de server.",
  "id": "pure",
  "naam": "Pure Energie",
  "website": "https://pure-energie.nl",
  "tariefUrl": "https://pure-energie.nl/energiecontract/dynamisch-energiecontract/",
  "producten": {
    "stroom": true,
    "gas": true
  },
  "kenmerken": {
    "automatischAfschakelen": null
  },
  "regels": {},
  "handmatig": {
    "stroomVastPerMaand": {
      "waarde": 6.05,
      "inclBtw": true,
      "geverifieerd": true,
      "gecontroleerdOp": "2026-09-24",
      "bron": "https://pure-energie.nl/energiecontract/dynamisch-energiecontract/",
      "notitie": "Prijsopbouw in de rekentool van Pure Energie, testadres Madurodam (2584RZ 1); 'Vaste leveringskosten' € 54,45 voor 9 maanden incl. btw (€ 5,00 per maand excl.)"
    },
    "stroomInkoopopslag": {
      "waarde": 0.01799,
      "inclBtw": true,
      "geverifieerd": true,
      "gecontroleerdOp": "2026-09-24",
      "bron": "https://pure-energie.nl/energiecontract/dynamisch-energiecontract/",
      "notitie": "Prijsopbouw in de rekentool van Pure Energie, testadres Madurodam (2584RZ 1); 'Inkoopvergoeding' € 0,01799/kWh incl. btw"
    },
    "gasVastPerMaand": {
      "waarde": 6.05,
      "inclBtw": true,
      "geverifieerd": true,
      "gecontroleerdOp": "2026-09-24",
      "bron": "https://pure-energie.nl/energiecontract/dynamisch-energiecontract/",
      "notitie": "Prijsopbouw in de rekentool van Pure Energie, testadres Madurodam (2584RZ 1); 'Vaste leveringskosten' € 54,45 voor 9 maanden incl. btw"
    },
    "gasInkoopopslag": {
      "waarde": 0.099,
      "inclBtw": true,
      "geverifieerd": true,
      "gecontroleerdOp": "2026-09-24",
      "bron": "https://pure-energie.nl/energiecontract/dynamisch-energiecontract/",
      "notitie": "Prijsopbouw in de rekentool van Pure Energie, testadres Madurodam (2584RZ 1); 'Inkoopvergoeding' € 0,09900/m³ incl. btw"
    },
    "terugleverCorrectie": {
      "waarde": -0.0149,
      "inclBtw": false,
      "geverifieerd": true,
      "gecontroleerdOp": "2026-09-24",
      "bron": "https://pure-energie.nl/energiecontract/dynamisch-energiecontract/",
      "notitie": "Prijsopbouw in de rekentool van Pure Energie, testadres Madurodam (2584RZ 1); 'Verkoopvergoeding' −€ 0,0149/kWh over netto teruglevering (marktprijs en vergoeding zijn excl. btw volgens de voorwaarden van Pure). Het bedrag incl. btw is omgerekend met 21% btw, net als bij de andere leveranciers."
    }
  }
}
